{
  "name": "E2E Tool Loop Limits",
  "description": "E2E test: tool loop safety limit enforcement. LLM keeps requesting tool calls; should stop at limit.",
  "namespace": "e2e-tests",
  "version": 1,
  "status": "active",
  "nodes": [
    {
      "id": "input-1",
      "name": "Input",
      "type": "input",
      "input_ports": [],
      "output_ports": [
        {"name": "user_message", "schema": {"type": "string"}}
      ],
      "config": {}
    },
    {
      "id": "assistant",
      "name": "Assistant",
      "type": "llm",
      "input_ports": [
        {"name": "user_prompt", "schema": {"type": "string"}}
      ],
      "output_ports": [
        {"name": "response_text", "schema": {"type": "string"}},
        {"name": "finish_reason", "schema": {"type": "string"}},
        {"name": "total_tool_calls", "schema": {"type": "integer"}}
      ],
      "config": {
        "provider": "openai",
        "model": "tool-loop-limits",
        "base_url": "http://mock-llm:9091",
        "api_key": "test-key",
        "user_prompt": "{{input.user_prompt}}",
        "tool_loop": true,
        "max_tool_calls": 3,
        "max_loop_iterations": 2,
        "tool_routing": {
          "echo": {"mcp_url": "http://mcp-test-server:9090"}
        }
      }
    },
    {
      "id": "output-1",
      "name": "Output",
      "type": "output",
      "input_ports": [
        {"name": "response", "schema": {"type": "string"}},
        {"name": "finish_reason", "schema": {"type": "string"}},
        {"name": "total_tool_calls", "schema": {"type": "integer"}}
      ],
      "output_ports": [
        {"name": "response", "schema": {"type": "string"}},
        {"name": "finish_reason", "schema": {"type": "string"}},
        {"name": "total_tool_calls", "schema": {"type": "integer"}}
      ],
      "config": {}
    }
  ],
  "edges": [
    {"id": "e1", "source_node_id": "input-1", "source_port": "user_message", "target_node_id": "assistant", "target_port": "user_prompt"},
    {"id": "e2", "source_node_id": "assistant", "source_port": "response_text", "target_node_id": "output-1", "target_port": "response"},
    {"id": "e3", "source_node_id": "assistant", "source_port": "finish_reason", "target_node_id": "output-1", "target_port": "finish_reason"},
    {"id": "e4", "source_node_id": "assistant", "source_port": "total_tool_calls", "target_node_id": "output-1", "target_port": "total_tool_calls"}
  ]
}
